video_id,title,channel,published_at
65CASowfnKs,AI Tutorial for Beginners 2026: How To Use AI &amp; Build ANYTHING,Mikey No Code,2026-03-11T14:05:19Z
Yq0QkCxoTHM,Google’s AI Course for Beginners (in 10 minutes)!,Jeff Su,2023-11-14T13:00:33Z
0Tch0N5nsRU,You’re not behind (yet): How to learn AI in 18 minutes,Dan Martell,2026-03-05T14:00:01Z
9c7zh2MkslY,You’re Not Behind (Yet): How to Learn AI in 29 Minutes,Futurepedia,2025-07-31T18:50:11Z
yHk7Vavmc7Q,AI Tools EXPLAINED:  How to Use Them? (2025 Guide for Beginners),AI Master,2024-12-12T14:01:02Z
IloPVzuhDaI,How To Create A Free App From Scratch (AI Tutorial + No Code),Mikey No Code,2026-02-06T14:35:24Z
LRhOzoxHlJo,Python AI And Generative AI Course For Beginners #ai #python #tutorial #course #study #learning,WebKnower,2025-09-08T08:45:12Z
nVyD6THcvDQ,99% of Beginners Don&#39;t Know the Basics of AI,Jeff Su,2024-09-03T13:00:49Z
Dem3ZSQ6RVM,Google AI Studio - Full Tutorial 2026: How To Build an App,Mikey No Code,2026-02-11T15:25:04Z
ibFJ--CH3cQ,You’re Not Behind (Yet): How to Build AI Agents in 2026 (no coding),Futurepedia,2026-02-21T00:50:43Z
JMUxmLyrhSk,Artificial Intelligence Full Course | Artificial Intelligence Tutorial for Beginners | Edureka,edureka!,2019-06-02T08:53:49Z
LGCZ-Fhm48c,AI Full Course 2025 | AI Tutorial for Beginners | Artificial Intelligence Course | Simplilearn,Simplilearn,2025-10-30T21:59:10Z
EWFFaKxsz_s,You’re Not Behind (Yet): How to Learn AI in 17 Minutes,theMITmonk,2025-11-10T14:00:33Z
c1soYpYzWfA,7 AI tools you NEED to try!,Kevin Stratvert,2025-03-18T17:50:20Z
ygeCgN-SfE8,"how i make $36,438/mo posting YouTube Shorts (using AI)",Kellan Henneberry,2025-10-29T18:15:06Z
vcvRVlc_VFg,Build a Whatsapp AI Agent for appointment handling (n8n Tutorial) #n8n #aiautomation,Ed Hill | AI Automation,2025-06-04T09:38:14Z
hLJTcVHW8_I,AI Agents Explained: A Comprehensive Guide for Beginners,AI Alfie ,2024-04-29T23:55:25Z
1MSVWUiNmxs,The fastest way to build a beautiful website with AI (bolt.new tutorial),Moritz | AI Builder,2024-10-14T15:00:20Z
BnquzIGVuKc,How to Make Cartoon Videos with AI (Full Tutorial),Roboverse,2025-11-05T15:00:31Z
sVcwVQRHIc8,Learn RAG From Scratch – Python AI Tutorial from a LangChain Engineer,freeCodeCamp.org,2024-04-17T13:54:43Z
